card,orientation,meaning
The Fool,upright,"New beginnings, optimism, trust in the journey."
The Fool,reversed,"Recklessness, fear of the unknown, poor judgment."
The Magician,upright,"Manifestation, resourcefulness, power."
The Magician,reversed,"Manipulation, illusion, untapped potential."
The Tower,upright,"Sudden upheaval, chaos, revelation."
The Tower,reversed,"Fear of change, delaying the inevitable, internal transformation."
The Lovers,upright,"Love, harmony, choices, alignment."
The Lovers,reversed,"Imbalance, disharmony, conflict, indecision."
